{"as_of_time":"2026-01-16T15:00:00Z","created_at":"2026-01-16T15:05:00Z","entity_nodes":[{"entity_id":"comp.sp500.aapl","entity_type":"COMPANY","identifier":"AAPL","name":"Apple Inc."},{"entity_id":"inst.us_equity.aapl","entity_type":"INSTRUMENT","identifier":"US0378331005","name":"Apple Inc. Common Stock"}],"knowledge_schema_version":1,"relationships":[{"effective_time":"2026-01-01T00:00:00Z","provenance_hash":"aaaaaaaaaaaaaaaaaaaaaaaaaaaaaaaaaaaaaaaaaaaaaaaaaaaaaaaaaaaaaaaa","relation_type":"ISSUES_INSTRUMENT","source_entity_id":"comp.sp500.aapl","target_entity_id":"inst.us_equity.aapl"}],"snapshot_id":"know.sp500.pit.001","source_lineage_hashes":["bbbbbbbbbbbbbbbbbbbbbbbbbbbbbbbbbbbbbbbbbbbbbbbbbbbbbbbbbbbbbbbb"]}
